{"$id":"https://locus.invalid/schemas/managed-performance-evidence-profile-v2.schema.json","$schema":"https://json-schema.org/draft/2020-12/schema","additionalProperties":false,"properties":{"checkpoint_id":{"const":"LOCUS-managed-performance-checkpoint-v1"},"collection_authorized":{"const":false},"decision_id":{"const":"D030"},"derived_ids":{"const":["LOCUS-managed-performance-summary-v2","LOCUS-managed-performance-comparison-v2","LOCUS-managed-performance-corpus-manifest-v2"]},"format_id":{"const":"LOCUS-managed-performance-evidence-profile-v2"},"instrumentation_id":{"const":"LOCUS-managed-performance-instrumentation-v2"},"measured_slot_count":{"const":312},"methodology_id":{"const":"LOCUS-managed-performance-methodology-v2"},"processor_id":{"const":"LOCUS-managed-performance-processor-v2"},"publication":{"const":"resumable-block-staging-then-exclusive-atomic-seal"},"result_ids":{"const":["LOCUS-managed-performance-result-yi-v2","LOCUS-managed-performance-result-appss-v2"]},"retained_root":{"const":"evidence/retained/managed-performance-v2"},"scenario_manifest_id":{"const":"LOCUS-managed-performance-scenario-manifest-v2"},"scheduled_slot_count":{"const":324},"staging_root":{"const":"evidence/retained/.managed-performance-v2-staging"},"status":{"const":"assigned-preparation-only"}},"required":["format_id","decision_id","methodology_id","instrumentation_id","scenario_manifest_id","processor_id","result_ids","derived_ids","checkpoint_id","scheduled_slot_count","measured_slot_count","retained_root","staging_root","publication","collection_authorized","status"],"type":"object"}
