{"checkpoint_id":"LOCUS-managed-performance-checkpoint-v1","collection_authorized":false,"decision_id":"D030","derived_ids":["LOCUS-managed-performance-summary-v2","LOCUS-managed-performance-comparison-v2","LOCUS-managed-performance-corpus-manifest-v2"],"format_id":"LOCUS-managed-performance-evidence-profile-v2","instrumentation_id":"LOCUS-managed-performance-instrumentation-v2","measured_slot_count":312,"methodology_id":"LOCUS-managed-performance-methodology-v2","processor_id":"LOCUS-managed-performance-processor-v2","publication":"resumable-block-staging-then-exclusive-atomic-seal","result_ids":["LOCUS-managed-performance-result-yi-v2","LOCUS-managed-performance-result-appss-v2"],"retained_root":"evidence/retained/managed-performance-v2","scenario_manifest_id":"LOCUS-managed-performance-scenario-manifest-v2","scheduled_slot_count":324,"staging_root":"evidence/retained/.managed-performance-v2-staging","status":"assigned-preparation-only"}
